[
  {
    "id": "D7-001",
    "domainId": "D7",
    "questionType": "single-choice",
    "difficulty": "standard",
    "question": "リポジトリをフォークする目的は何ですか？",
    "choices": [
      { "id": "A", "text": "アップストリームリポジトリのコピーを作成し、元のリポジトリに直接変更を加えられるようにする" },
      { "id": "B", "text": "元のリポジトリを改善する方法を確認できるイシューが自動的に作成される" },
      { "id": "C", "text": "元のリポジトリに影響を与えずにプロジェクトの変更を行う" },
      { "id": "D", "text": "変更内容をチームに共有するためのプルリクエストが作成される" }
    ],
    "correctChoiceIds": ["C"],
    "explanation": "リポジトリをフォークすると、元のリポジトリに影響を与えずに自分のコピーで変更を加えられます。フォーク後はアップストリームから更新を取得しながら、プルリクエストを使って元のリポジトリへの変更を提案できます。",
    "references": [
      {
        "title": "リポジトリをフォークする",
        "url": "https://docs.github.com/ja/pull-requests/collaborating-with-pull-requests/working-with-forks/fork-a-repo",
        "source": "GitHub Docs",
        "checkedAt": "2026-05-31"
      }
    ],
    "tags": ["fork", "open-source"],
    "updatedAt": "2026-07-13"
  },
  {
    "id": "D7-002",
    "domainId": "D7",
    "questionType": "single-choice",
    "difficulty": "exam",
    "question": "インナーソース（InnerSource）について最もよく説明しているものはどれですか？",
    "choices": [
      { "id": "A", "text": "オープンソースは誰でも貢献できますが、InnerSource はリポジトリを所有するチームのメンバーからの貢献のみを受け入れます" },
      { "id": "B", "text": "InnerSource はオープンソースをフォークして組織内だけで使用・管理するために作られます" },
      { "id": "C", "text": "InnerSource は基本的にオープンソースと同じですが、アクセスできるのは組織内のユーザーに限られます" },
      { "id": "D", "text": "InnerSource は誰でも利用でき、プロジェクトを自由に閲覧・変更・配布できます" }
    ],
    "correctChoiceIds": ["C"],
    "explanation": "InnerSource とオープンソースはどちらも、リポジトリを所有するチーム外からの貢献を受け入れる仕組みです。ただし InnerSource はアクセスが組織内に限定されており、オープンソースのように世界中に公開されているわけではありません。",
    "references": [
      {
        "title": "An introduction to innersource",
        "url": "https://resources.github.com/innersource/fundamentals/",
        "source": "GitHub Resources",
        "checkedAt": "2026-06-02"
      }
    ],
    "tags": ["innersource", "open-source", "collaboration"],
    "updatedAt": "2026-07-13"
  },
  {
    "id": "D7-003",
    "domainId": "D7",
    "questionType": "multiple-choice",
    "difficulty": "standard",
    "question": "書き込み権限を持たないオープンソースリポジトリに変更を貢献する際の正しい手順を2つ選んでください。",
    "choices": [
      { "id": "A", "text": "元のリポジトリを Fork して自分のアカウントにコピーを作成する" },
      { "id": "B", "text": "元のリポジトリに直接 git push origin main を実行する" },
      { "id": "C", "text": "Fork したリポジトリでブランチを作成し、変更をコミットしてから元のリポジトリへ Pull Request を送る" },
      { "id": "D", "text": "元のリポジトリのオーナーに SSH 鍵を渡してもらい直接プッシュする" }
    ],
    "correctChoiceIds": ["A", "C"],
    "explanation": "書き込み権限のない外部コントリビューターが OSS に貢献する標準的な手順は、①元リポジトリを Fork する → ②Fork 上でブランチを作成し変更をコミットする → ③Fork から元リポジトリへ Pull Request を送る、です。元リポジトリへの直接 push は権限エラーになります。",
    "references": [
      {
        "title": "プロジェクトに貢献する",
        "url": "https://docs.github.com/ja/get-started/exploring-projects-on-github/contributing-to-a-project",
        "source": "GitHub Docs",
        "checkedAt": "2026-06-02"
      }
    ],
    "tags": ["fork", "open-source", "contribution", "pull-request"],
    "updatedAt": "2026-06-02"
  },
  {
    "id": "D7-005",
    "domainId": "D7",
    "questionType": "single-choice",
    "difficulty": "standard",
    "question": "GitHub Sponsors の説明として最も適切なものはどれですか？",
    "choices": [
      { "id": "A", "text": "GitHub が OSS 開発者に広告収益を分配する仕組み" },
      { "id": "B", "text": "個人・組織が OSS 開発者やプロジェクトを金銭的に支援できる機能" },
      { "id": "C", "text": "企業が GitHub のエンタープライズプランを契約するための申請フォーム" },
      { "id": "D", "text": "GitHub Actions の実行コストを他ユーザーに負担してもらう機能" }
    ],
    "correctChoiceIds": ["B"],
    "explanation": "GitHub Sponsors は OSS 開発者・チーム・プロジェクトを月次または単発の金銭的サポートで支援できる機能です。スポンサーは開発者のプロフィールや README に表示されます。個人アカウントへのスポンサーシップには GitHub の手数料がかからず、組織アカウントへのスポンサーシップには別途手数料が適用される場合があります。",
    "references": [
      {
        "title": "GitHub スポンサーについて",
        "url": "https://docs.github.com/ja/sponsors/getting-started-with-github-sponsors/about-github-sponsors",
        "source": "GitHub Docs",
        "checkedAt": "2026-05-31"
      }
    ],
    "tags": ["sponsors", "open-source"],
    "updatedAt": "2026-05-31"
  },
  {
    "id": "D7-006",
    "domainId": "D7",
    "questionType": "single-choice",
    "difficulty": "standard",
    "question": "Fork とテンプレートリポジトリ（Template repository）の違いとして最も適切なものはどれですか？",
    "choices": [
      { "id": "A", "text": "Fork はコミット履歴を引き継ぐが、テンプレートから作成したリポジトリは履歴を引き継がない" },
      { "id": "B", "text": "Fork はパブリックリポジトリのみ可能で、テンプレートはプライベートリポジトリでも使える" },
      { "id": "C", "text": "Fork とテンプレートは全く同じ機能を指す別名である" },
      { "id": "D", "text": "テンプレートから作成したリポジトリは元のリポジトリと自動同期される" }
    ],
    "correctChoiceIds": ["A"],
    "explanation": "Fork は元リポジトリとのコミット履歴・関係性を維持し、Pull Request で上流に貢献することを前提とします。テンプレートリポジトリから作成されるリポジトリはコミット履歴を持たない新規スタートで、上流への貢献ではなくプロジェクト雛形の再利用が目的です。",
    "references": [
      {
        "title": "リポジトリをフォークする",
        "url": "https://docs.github.com/ja/pull-requests/collaborating-with-pull-requests/working-with-forks/fork-a-repo",
        "source": "GitHub Docs",
        "checkedAt": "2026-05-31"
      }
    ],
    "tags": ["fork", "template", "repository"],
    "updatedAt": "2026-05-31"
  },
  {
    "id": "D7-007",
    "domainId": "D7",
    "questionType": "single-choice",
    "difficulty": "advanced",
    "question": "InnerSource を実践する際にリポジトリを Internal 可視性に設定する主な理由はどれですか？",
    "choices": [
      { "id": "A", "text": "リポジトリをインターネット上に公開してより多くの貢献者を集めるため" },
      { "id": "B", "text": "社内の全メンバーがコードを参照・貢献できるようにしながら、社外への公開は防ぐため" },
      { "id": "C", "text": "リポジトリへのアクセスをオーナーのみに制限するため" },
      { "id": "D", "text": "GitHub Actions の実行コストを削減するため" }
    ],
    "correctChoiceIds": ["B"],
    "explanation": "Internal 可視性は Enterprise 内の全認証済みメンバーが閲覧・フォーク・貢献できる状態を作りながら、外部への公開は防ぎます。これにより社内のコード共有・横断的な貢献・知識の民主化が実現し、InnerSource の基盤として機能します。",
    "references": [
      {
        "title": "リポジトリの可視性を設定する",
        "url": "https://docs.github.com/ja/repositories/managing-your-repositorys-settings-and-features/managing-repository-settings/setting-repository-visibility",
        "source": "GitHub Docs",
        "checkedAt": "2026-05-31"
      }
    ],
    "tags": ["innersource", "repository", "visibility"],
    "updatedAt": "2026-05-31"
  },
  {
    "id": "D7-008",
    "domainId": "D7",
    "questionType": "single-choice",
    "difficulty": "standard",
    "question": "あなたは自分のダッシュボードを見ると、フォローしている開発者が最近スターを付けたリポジトリが表示されています。この仕組みから得られる主なメリットはどれですか？",
    "choices": [
      { "id": "A", "text": "フォロー相手の全リポジトリへの Write 権限が自動的に付与される" },
      { "id": "B", "text": "フォロー相手の公開アクティビティを通じて、自分が気づいていなかった有望な OSS プロジェクトを発見できる" },
      { "id": "C", "text": "スターを付けたリポジトリに自分が自動的にコントリビューターとして追加される" },
      { "id": "D", "text": "スターを付けたリポジトリのすべての Issue に自動的にアサインされる" }
    ],
    "correctChoiceIds": ["B"],
    "explanation": "GitHub でユーザーをフォローすると、そのユーザーが Star を付けたリポジトリや新規フォークなどの公開アクティビティがダッシュボードフィードに表示されます。これにより、信頼する開発者の活動を通じて新しい OSS プロジェクトや技術トレンドを効率的に発見できます。",
    "references": [
      {
        "title": "人をフォローする",
        "url": "https://docs.github.com/ja/get-started/exploring-projects-on-github/following-people",
        "source": "GitHub Docs",
        "checkedAt": "2026-06-02"
      },
      {
        "title": "スターを付けてリポジトリをブックマークする",
        "url": "https://docs.github.com/ja/get-started/exploring-projects-on-github/saving-repositories-with-stars",
        "source": "GitHub Docs",
        "checkedAt": "2026-06-02"
      }
    ],
    "tags": ["star", "follow", "community", "discover"],
    "updatedAt": "2026-06-02"
  },
  {
    "id": "D7-009",
    "domainId": "D7",
    "questionType": "single-choice",
    "difficulty": "basic",
    "question": "GitHub プラットフォームで、あるユーザーのパブリックな活動を継続的に把握するにはどうすればよいですか？",
    "choices": [
      { "id": "A", "text": "そのユーザーのリポジトリに Star を付ける" },
      { "id": "B", "text": "そのユーザーをフォローする" },
      { "id": "C", "text": "そのユーザーのリポジトリを Watch する" },
      { "id": "D", "text": "そのユーザーを Issue にメンションする" }
    ],
    "correctChoiceIds": ["B"],
    "explanation": "ユーザーをフォローするとそのユーザーのパブリックな活動（スター・フォーク・コントリビューションなど）がダッシュボードフィードに表示されます。Star はブックマーク目的（A）、Watch は特定リポジトリの通知（C）、メンションは会話への呼びかけ（D）であり、いずれもユーザー全体の活動追跡ではありません。",
    "references": [
      {
        "title": "人をフォローする",
        "url": "https://docs.github.com/ja/get-started/exploring-projects-on-github/following-people",
        "source": "GitHub Docs",
        "checkedAt": "2026-05-31"
      }
    ],
    "tags": ["follow", "community"],
    "updatedAt": "2026-07-13"
  },
  {
    "id": "D7-010",
    "domainId": "D7",
    "questionType": "single-choice",
    "difficulty": "standard",
    "question": "Fork したリポジトリを元のリポジトリ（上流）の最新状態に同期する方法として正しいものはどれですか？",
    "choices": [
      { "id": "A", "text": "Fork を一度削除して再度 Fork し直す" },
      { "id": "B", "text": "GitHub の「Sync fork」ボタンまたは git コマンドで上流の変更を取り込む" },
      { "id": "C", "text": "上流のオーナーに自分の Fork へ push してもらう" },
      { "id": "D", "text": "Fork したリポジトリは上流と自動同期されるため手動操作は不要" }
    ],
    "correctChoiceIds": ["B"],
    "explanation": "GitHub の Web UI にある「Sync fork」ボタンをクリックするか、ローカルで上流リモートを追加して `git fetch upstream → git merge upstream/main` を実行することで Fork を上流と同期できます。OSS に継続貢献する際は定期的な同期が重要です。",
    "references": [
      {
        "title": "フォークを同期する",
        "url": "https://docs.github.com/ja/pull-requests/collaborating-with-pull-requests/working-with-forks/syncing-a-fork",
        "source": "GitHub Docs",
        "checkedAt": "2026-05-31"
      }
    ],
    "tags": ["fork", "sync"],
    "updatedAt": "2026-05-31"
  },
  {
    "id": "D7-011",
    "domainId": "D7",
    "questionType": "single-choice",
    "difficulty": "basic",
    "question": "初めてオープンソースに貢献する候補を探すとき、GitHub の `good first issue` ラベルを使う主な理由はどれですか？",
    "choices": [
      { "id": "A", "text": "メンテナーが最優先で対応すべき緊急バグを示すラベルだから" },
      { "id": "B", "text": "初心者や新規コントリビューターが取り組みやすい Issue を見つけるため" },
      { "id": "C", "text": "このラベルが付いた Issue は自動的に担当者にアサインされるから" },
      { "id": "D", "text": "help wanted ラベルよりも報酬が高い Issue を示すラベルだから" }
    ],
    "correctChoiceIds": ["B"],